Question|Option1|Option2|Option3|Option4|Option5|Answer1|Answer2|Answer3|Answer4|Answer5|Notes|xNotes
纳税人、扣缴义务人的开户银行或者其他金融机构拒绝接受税务机关依法检查纳税人、扣缴义务人存款账户，或者拒绝执行税务机关作出的冻结存款或者扣缴税款的决定，或者在接到税务机关的书面通知后帮助纳税人、扣缴义务人转移存款，造成税款流失的，由税务机关处1万元以上5万元以下的罚款，对直接负责的主管人员和其他直接责任人员处1000元以上１万元以下的罚款。（    ）|正确|错误||||2|||||P-260 处10万元以上50万元以下的罚款|P-260 处10万元以上50万元以下的罚款
评估审核人员不得参与同一评估对象的税务约谈、调查审核和纳税评估处理工作。（    ）|正确|错误||||1|||||P-265|P-265
纳税评估报告审核指评估审核人员依据评估实施人员推送的《纳税评估报告》及相应的评估资料按权限进行审核审批的过程。（   ）|正确|错误||||1|||||P-265|P-265
纳税评估执行是指评估执行人员根据经审批同意后的《纳税评估报告》中提出的评估处理建议进行相应后续处理的过程。（   ）|正确|错误||||1|||||P-265|P-265
文书送达是一个法律程序，是税务机关的法定职责，应以法定的程序和方式进行，未按法定程序和方式送达，不产生文书送达的法律效力。（   ）|正确|错误||||1|||||P-266|P-266
税务文书送达有5种方式，其中邮寄送达便捷，适用于各种情形，但邮寄送达税务文书不易产生法律效力。（    ）|正确|错误||||1|||||P-267|P-267
凡是能够直接送达的，均应采取直接送达的方式。（    ）|正确|错误||||1|||||P-266|P-266
《税务文书送达回证》是税务机关是否已送达税务文书的一个证明，只有正确、完整、合法、真实地签写送达回证，才能确保执法的程序不违法。（    ）|正确|错误||||1|||||P-267|P-267
以邮寄方式送达文书，《税务文书送达回证》和回执均未交回的，税务机关可通过中国邮政网站的给据邮件跟踪查询系统或者EMS追踪查询系统根据邮件编号进行网上查询，也可凭挂号信函收据或者EMS收据到邮政营业厅查询。网上查询的，应当通过拍照或者打印、影印等方式固定证据；到邮政营业厅查询的，应当保存邮政机构出具的查询情况说明。（    ）|正确|错误||||1|||||P-268|P-268
违法违章处理报告审议应以集体会议审议形式开展，审议情况及结论应制作审议记录，参加人员应签字确认。（   ）|正确|错误||||1|||||P-268|P-268
当事人要求陈述、申辩的，检查人员应当听取当事人的陈述申辩，当事人应在收到税务行政处罚告知事项之日起5日内向税务机关陈述、申辩，进行陈述、申辩可以采取口头形式或书面形式。（    ）|正确|错误||||2|||||P-269 3日内|P-269 3日内
税务机关不能因当事人的陈述或申辩而加重处罚。（    ）|正确|错误||||1|||||P-269|P-269
听证费用由要求举行听证的当事人支付。（    ）|正确|错误||||2|||||P-270 听证费用由组织听证的税务机关支付。|P-270 听证费用由组织听证的税务机关支付。
税务机关在送达文书时，要讲究策略，文书送达方式应灵活运用。只有充分掌握税务文书送达的方式、步骤、时限、次序以及税务文书送达回证的签写工作，执法程序才不会违法，行政行为才能真正合法有效。（    ）|正确|错误||||1|||||P-268|P-268
纳税人对该疑点或问题认识清楚，与评估人员对处理办法达成一致的，可由纳税人自行改正，补正申报、补缴税款、调整账目。（    ）|正确|错误||||1|||||P-264|P-264
阻止欠税纳税人出境期限一般为3个月。限制出境时间到期前20日，税务局确认欠税纳税人仍未按规定结清应纳税款、滞纳金又未提供纳税担保，需继续限制出境的，按照规定程序继续办理。到期不续报，公安边防部门将自动解除边控。（    ）|正确|错误||||2|||||P-278 限制出境时间到期前15日|P-278 限制出境时间到期前15日
纳税申报义务履行情况分析与审核主要是围绕申报的及时性进行审核，包括是否办理纳税申报的审核和纳税申报的及时性审核。（   ）|正确|错误||||1|||||P-281|P-281
流动资产的分析重点是货币资金、存货和应收款项等项目。对于货币资金的分析，主要考虑真实性的分析，弱化对量的分析。（    ）|正确|错误||||2|||||P-284 首先是量的分析，其次是真实性的分析|P-284 首先是量的分析，其次是真实性的分析
利润表重点项目的分析与审核对利润表项目的审核分析，主要是审核分析利润形成的各指标的真实性和合理性，多用相对数指标，与同期比，与同行业比，与预警值比。（    ）|正确|错误||||1|||||P-286|P-286
在对纳税人的资格认定和备案资料审核中，应当严格把关，围绕认定资料和备案资料的完整性和与有关政策的符合性进行统一审核。（   ）|正确|错误||||1|||||P-280|P-280
根据《国家税务总局关于发布〈企业所得税优惠政策事项办理办法〉的公告》（国家税务总局公告2015第76号）的规定，企业所得税法规定的优惠事项，以及税法授权国务院和民族自治地方制定的优惠事项，凡享受企业所得税优惠的，均应当向税务机关履行备案手续。企业应当不迟于年度汇算清缴纳税申报时备案。（     ）|正确|错误||||1|||||P-280-281|P-280-281
当事人要求陈述、申辩的，检查人员应当听取当事人的陈述申辩，当事人应在收到税务行政处罚告知事项之日起３日内向税务机关陈述、申辩，进行陈述、申辩可以采取口头形式或书面形式。（    ）|正确|错误||||1|||||P-269|P-269
开展营业收入的分析，不能忽略对发票的检查，发票是纳税评估的重要资料，在销售环节不使用发票的企业，隐瞒收入的可能性要比使用发票的企业大。（    ）|正确|错误||||1|||||P-286|P-286
资产负债表中货币资金、应收账款、预收账款的增减幅度变化与利润表中营业收入的增减变化之比，可发现营业成本中的误差。（    ）|正确|错误||||2|||||P-286 资产负债表中货币资金、应收账款、预收账款的增减幅度变化与利润表中营业收入的增减变化之比，可发现营业收入中的误差。|P-286 资产负债表中货币资金、应收账款、预收账款的增减幅度变化与利润表中营业收入的增减变化之比，可发现营业收入中的误差。
税收优先于无担保债权，但法律另有规定的除外，如在破产程序中，职工的工资属于债权，但考虑到职工基本生活的保障这一更高的人权宗旨，职工的工资优先于国家的税收而受到清偿。（    ）|正确|错误||||1|||||P274-275|P274-275
欠税追征中，为了体现追征的严肃性，不可采用电话追征。（    ）|正确|错误||||2|||||P272 在追征告知无果的情况下，为避免与欠税纳税人直接接触时可能遇到的一些尴尬情况等不利因素的影响，同时为避免因追征欠税款而耽误欠税纳税人的时间或影响欠税纳税人日常生产经营，为节约行政成本提高行政工作效率，可采用电话追征。|P272 在追征告知无果的情况下，为避免与欠税纳税人直接接触时可能遇到的一些尴尬情况等不利因素的影响，同时为避免因追征欠税款而耽误欠税纳税人的时间或影响欠税纳税人日常生产经营，为节约行政成本提高行政工作效率，可采用电话追征。
税务机关不得在没有先行扣押、查封，而直接将其应纳税款的商品、货物或者其他财产依法拍卖、变卖。（   ）|正确|错误||||2|||||税务机关也可以不先行扣押、查封，而是直接将其应纳税款的商品、货物或者其他财产依法拍卖、变卖。|税务机关也可以不先行扣押、查封，而是直接将其应纳税款的商品、货物或者其他财产依法拍卖、变卖。
税收优先权是指当税款与其他债权并存时，税款有优先受偿权。（   ）|正确|错误||||1|||||P-274|P-274
根据法律的规定，税务机关行使撤销权的方式是执法行为直接实现。（    ）|正确|错误||||2|||||P277 根据法律的规定，税务机关行使撤销权的方式是诉讼方式，而不是由税务机关的执法行为直接实现。|P277 根据法律的规定，税务机关行使撤销权的方式是诉讼方式，而不是由税务机关的执法行为直接实现。
公安边防部门阻止欠税纳税人出境时，申请阻止出境的主管局应派员到场，当面告知当事人被阻止出境的事由、欠税金额、依据及处理决定，同时告知未结清税款、滞纳金或未提供纳税担保前不得离境等内容。（    ）|正确|错误||||1|||||P-277-278|P-277-278
税务机关对列入备案管理的优惠项目，应在相关性审核的基础上，对跨年度优惠项目建立管理台账进行动态跟踪监控，如创业投资抵扣应纳税所得额，专用设备投资抵免应纳税额等。（  ）|正确|错误||||1|||||P-281|P-281
因纳税人或扣缴义务人计算错误等失误，未缴或者少缴税款的，累计数额在10万元以上的，税务机关在3年内可以追征。（   ）|正确|错误||||2|||||公共知识P-144 因纳税人、扣缴义务人非主观故意的计算公式运用错误以及明显的笔误等失误，未缴或者少缴税款的，税务机关在3年内可以追征税款、滞纳金；累计数额在10万元以上的，追征期可以延长到5年。|公共知识P-144 因纳税人、扣缴义务人非主观故意的计算公式运用错误以及明显的笔误等失误，未缴或者少缴税款的，税务机关在3年内可以追征税款、滞纳金；累计数额在10万元以上的，追征期可以延长到5年。
中华人民共和国境外的单位或者个人在境内提供应税劳务，以购买方为扣缴义务人。（    ）|正确|错误||||2|||||公共知识P-87中华人民共和国境外的单位或者个人在境内提供应税劳务，在境内未设有经营机构的，以其境内代理人为扣缴义务人；在境内没有代理人的，以购买方为扣缴义务人。|公共知识P-87中华人民共和国境外的单位或者个人在境内提供应税劳务，在境内未设有经营机构的，以其境内代理人为扣缴义务人；在境内没有代理人的，以购买方为扣缴义务人。
城市维护建设税的适用税率包括1%、3%、5%、7%。（   ）|正确|错误||||2|||||公共知识P-125城市维护建设税的适用税率包括1%、5%、7%。|公共知识P-125城市维护建设税的适用税率包括1%、5%、7%。
我国印花税的税率采用比例税率和定额税率两种形式征收。（   ）|正确|错误||||1|||||公共知识P-128|公共知识P-128
企业对外投资期间，投资资产的成本在计算应纳税所得额时准予扣除。（   ）|正确|错误||||2|||||公共知识P-104企业对外投资期间，投资资产的成本在计算应纳税所得额时不得扣除。|公共知识P-104企业对外投资期间，投资资产的成本在计算应纳税所得额时不得扣除。
劳务报酬所得一次收入畸高，是指个人一次取得劳务报酬，其收入额超过2万元。（    ）|正确|错误||||2|||||公共知识P-109劳务报酬所得一次收入畸高，是指个人一次取得劳务报酬，其应纳税所得额超过2万元。|公共知识P-109劳务报酬所得一次收入畸高，是指个人一次取得劳务报酬，其应纳税所得额超过2万元。
向出租方支付的租金，属于财产租赁（转租）所得个人所得税税前扣除范围。（   ）|正确|错误||||1|||||P-60个人转租房屋的，其向房屋出租方支付的租金及增值税额，在计算转租所得时予以扣除。|P-60个人转租房屋的，其向房屋出租方支付的租金及增值税额，在计算转租所得时予以扣除。
我国的土地增值税适用四级超额累进税率。（   ）|正确|错误||||2|||||公共知识P-129我国的土地增值税适用四级超率累进税率。|公共知识P-129我国的土地增值税适用四级超率累进税率。
2013年1月，某市区的外商投资企业销售产品取得收入200万元，当期缴纳了增值税8万元。按规定企业应缴纳城市维护建设税0.56万元。（    ）|正确|错误||||1|||||公共知识P-127 纳税人所在地在市区的，税率为7%|公共知识P-127 纳税人所在地在市区的，税率为7%
纳税人提供有形动产租赁服务采取预收款方式的，其纳税义务发生时间为租赁服务发生的当天。(    ) |正确|错误||||2|||||P-36纳税人提供有形动产租赁服务采取预收款方式的，其纳税义务发生时间为收到预收款的当天|P-36纳税人提供有形动产租赁服务采取预收款方式的，其纳税义务发生时间为收到预收款的当天
增值税一般纳税人提供仓储服务，可以选择按照简易计税方法计算缴纳增值税的。（    ）|正确|错误||||1|||||P-137一般纳税人提供的电影放映服务、仓储服务、装卸搬运服务、收派服务和文化体育服务，可以选择按照简易计税方法计算缴纳增值税。|P-137一般纳税人提供的电影放映服务、仓储服务、装卸搬运服务、收派服务和文化体育服务，可以选择按照简易计税方法计算缴纳增值税。
企业与其关联方之间的业务往来，不符合独立交易原则，或者企业实施其他不具有合理商业目的安排的，税务机关有权在该业务发生的纳税年度起5年内，进行纳税调整。（    ）|正确|错误||||2|||||公共知识P-142纳税人与其关联企业之间的业务往来，应当按照独立企业之间的业务往来收取或者支付价款、费用；不按照独立企业之间的业务往来收取或者支付价款、费用，而减少其应纳税的收入或者所得额的，税务机关有权自该业务往来发生的纳税年度起3年内进行调整；有特殊情况的，可以自该业务往来发生的纳税年度起10年内进行调整。|公共知识P-142纳税人与其关联企业之间的业务往来，应当按照独立企业之间的业务往来收取或者支付价款、费用；不按照独立企业之间的业务往来收取或者支付价款、费用，而减少其应纳税的收入或者所得额的，税务机关有权自该业务往来发生的纳税年度起3年内进行调整；有特殊情况的，可以自该业务往来发生的纳税年度起10年内进行调整。
企业发生的全部业务招待费支出，按照发生额的60%扣除，但最高不得超过当年销售（营业）收入的5‰。（    ）|正确|错误||||2|||||公共知识P-102，企业发生的与生产经营活动有关的业务招待费支出，按照发生额的60%扣除，但最高不得超过当年销售（营业）收入的5‰。|公共知识P-102，企业发生的与生产经营活动有关的业务招待费支出，按照发生额的60%扣除，但最高不得超过当年销售（营业）收入的5‰。
企业向股东或其他与企业有关联关系的自然人借款的利息支出，一律不得在企业所得税税前扣除。（    ） |正确|错误||||2|||||企业向股东或其他与企业有关联关系的自然人借款的利息支出，应根据财税[2008]121号规定的条件，计算企业所得税扣除额。|企业向股东或其他与企业有关联关系的自然人借款的利息支出，应根据财税[2008]121号规定的条件，计算企业所得税扣除额。
企业发生的公益性捐赠支出，不超过年度收入总额12%的部分，准予扣除。（    ）|正确|错误||||2|||||公共知识P-102 企业发生的公益性捐赠支出，不超过年度利润总额12%的部分，准予扣除。|公共知识P-102 企业发生的公益性捐赠支出，不超过年度利润总额12%的部分，准予扣除。
被清算企业的股东，从被清算企业分得的资产应按原账面价值确定计税基础。（    ）|正确|错误||||2|||||被清算企业的股东从被清算企业分得的资产应按可变现价值或实际交易价格确定计税基础。|被清算企业的股东从被清算企业分得的资产应按可变现价值或实际交易价格确定计税基础。
企业为投资者或者职工支付的商业保险费，一律不得扣除。（    ）|正确|错误||||2|||||企业为投资者或者职工支付的商业保险费，符合相关规定的，可以扣除，例如分别不超过职工工资总额5%的补充养老保险和补充医疗保险、为特殊工种职工支付的法定人身安全保险费等。|企业为投资者或者职工支付的商业保险费，符合相关规定的，可以扣除，例如分别不超过职工工资总额5%的补充养老保险和补充医疗保险、为特殊工种职工支付的法定人身安全保险费等。
除国务院财政、税务主管部门另有规定外，企业发生的职工教育经费支出，不超过工资薪金总额的2.5%部分准予扣除，超过部分准予在以后纳税年度中结转扣除。（    ）|正确|错误||||1|||||公共知识P-102|公共知识P-102
增值税一般纳税人将自产货物用于本单位职工福利的，虽未销售，但应视同销售货物计算销项税额。（    ）|正确|错误||||1|||||公共知识P-101企业发生非货币性资产交换，以及将货物、财产、劳务用于捐赠、偿债、赞助、集资、广告、样品、职工福利或者利润分配等用途的，应当视同销售货物|公共知识P-101企业发生非货币性资产交换，以及将货物、财产、劳务用于捐赠、偿债、赞助、集资、广告、样品、职工福利或者利润分配等用途的，应当视同销售货物
中华人民共和国境内的单位和个人提供的国际运输服务，适用增值税税率为11%。（    ）|正确|错误||||2|||||P-33 中华人民共和国境内的单位和个人提供的国际运输服务，适用增值税零税率。|P-33 中华人民共和国境内的单位和个人提供的国际运输服务，适用增值税零税率。
增值税一般纳税人购进用于对外捐赠的货物，取得法定扣税凭证的，可以抵扣增值税进项税额。（   ）|正确|错误||||1||||||
企业从事符合条件的环境保护、节能节水项目的所得，可以按规定免征、减征企业所得税。（    ）|正确|错误||||1|||||公共知识P-107 从事符合条件的环境保护、节能节水项目的所得，自项目取得第一笔生产经营收入所属纳税年度起，第一年至第三年免征企业所得税，第四年至第六年减半征收企业所得税。|公共知识P-107 从事符合条件的环境保护、节能节水项目的所得，自项目取得第一笔生产经营收入所属纳税年度起，第一年至第三年免征企业所得税，第四年至第六年减半征收企业所得税。
企业因生产经营、产品营销的需要，在费用中列支的赠予外单位个人的礼金、礼品等支出，应按照工资薪金所得扣缴个人所得税。（    ）|正确|错误||||2|||||企业因生产经营、产品营销的需要，在费用中列支的赠予外单位个人的礼金、礼品等支出，应按照其他所得扣缴个人所得税。|企业因生产经营、产品营销的需要，在费用中列支的赠予外单位个人的礼金、礼品等支出，应按照其他所得扣缴个人所得税。
个人保险代理人以其取得的佣金、奖励和劳务费等相关收入减去地方税费附加及展业成本，按照规定计算个人所得税。展业成本，为佣金收入减去地方税费附加余额的40%。（    ）|正确|错误||||1|||||公共知识P-298|公共知识P-298
资源税计税销售额是指纳税人销售应税产品向购买方收取的全部价款和价外费用，不包括增值税销项税额和运杂费用。（    ）|正确|错误||||1|||||公共知识P-292|公共知识P-292
按企业所得税现行相关政策规定，符合规定条件的小型微利企业，无论采取查账征收还是核定征收方式，均可享受小型微利企业所得税优惠政策。（   ）|正确|错误||||1||||||
居民企业以非货币性资产对外投资确认的非货币性资产转让所得，可在不超过5年期限内，分期均匀计入相应年度的应纳税所得额，按规定计算缴纳企业所得税。（    ）|正确|错误||||1|||||征管评估P-142 4、《非货币性资产投资递延纳税调整明细表》的报送条件为实行查账征收的居民企业以非货币性资产对外投资确认的非货币性资产转让所得，在自确认非货币性资产转让收入年度起不超过连续5个纳税年度的期间内，分期均匀计入相应年度的应纳税所得额的，应在非货币性资产转让所得递延确认期间每年企业所得税汇算清缴时报送。|征管评估P-142 4、《非货币性资产投资递延纳税调整明细表》的报送条件为实行查账征收的居民企业以非货币性资产对外投资确认的非货币性资产转让所得，在自确认非货币性资产转让收入年度起不超过连续5个纳税年度的期间内，分期均匀计入相应年度的应纳税所得额的，应在非货币性资产转让所得递延确认期间每年企业所得税汇算清缴时报送。
享受环境保护、节能节水、安全生产等专用设备抵免的企业，应当实际购置并自身实际投入使用上述规定的专用设备；企业购置上述专用设备在5年内转让、出租的，应当停止该优惠，并补缴已经抵免的企业所得税税款。(    )|正确|错误||||1||||||
2011年5月3日，国家税务总局下发《关于印发<“十二五”时期税收发展规划纲要>的通知》，明确提出十二五期间将“实施税收风险管理。将风险管理理念贯穿于税收征管全过程。”这一纲要的出台，标识着税收风险管理工作在全国范围进入了探索阶段。（    ）|正确|错误||||1|||||P-290|P-290
总局税收风险管理工作领导小组负责指导全国范围内的税收风险管理工作。（    ）|正确|错误||||2|||||P-293 总局税收风险管理工作领导小组办公室负责指导全国范围内的税收风险管理工作。|P-293 总局税收风险管理工作领导小组办公室负责指导全国范围内的税收风险管理工作。
税务总局负责税收风险管理制度和机制的顶层设计。（    ）|正确|错误||||1|||||P-294|P-294
市、县税务机关重点做好组织开展风险分析识别工作和税收风险应对工作。其他税收风险管理工作事项，由省税务机关具体规定。（    ）|正确|错误||||2|||||P-294 市、县税务机关重点做好税收风险应工作,必要时，也可以组织开展风险分析识别工作。其他税收风险管理工作事项，由省税务机关具体规定|P-294 市、县税务机关重点做好税收风险应工作,必要时，也可以组织开展风险分析识别工作。其他税收风险管理工作事项，由省税务机关具体规定
税收风险管理工作要结合实际积极开发省级税务总局的决策支持（风险管理）系统，实现税收征管信息系统与决策支持系统的有机衔接，充分发挥信息化平台的支撑作用。（    ）|正确|错误||||2|||||税收风险管理工作要结合实际积极应用税务总局的决策支持（风险管理）系统，实现税收征管信息系统与决策支持系统的有机衔接，充分发挥信息化平台的支撑作用。|税收风险管理工作要结合实际积极应用税务总局的决策支持（风险管理）系统，实现税收征管信息系统与决策支持系统的有机衔接，充分发挥信息化平台的支撑作用。
税收风险管理的目标是提高纳税遵从水平，为愿意遵从的纳税人提供便利化办税条件，对不遵从的纳税人予以惩罚震慑，将从根本上解决纳税人不愿遵从或无遵从标准的问题。（    ）|正确|错误||||1|||||P-291|P-291
税收风险管理是一项需要持续改进的系统工程。需要在统一认识、明确任务、建立机制、厘清职责的基础上，不断调整、改革、完善，使之发挥越来越大的作用。（    ）|正确|错误||||1|||||P-291|P-291
在大企业税收管理过程中，要运用税收风险管理的理念和方法，提升大企业所有涉税事项的管理层级，促进税收征管整体资源的优化配置。（    ）|正确|错误||||2|||||P-291在大企业税收管理过程中，要运用税收风险管理的理念和方法，提升大企业复杂涉税事项的管理层级，促进税收征管整体资源的优化配置。|P-291在大企业税收管理过程中，要运用税收风险管理的理念和方法，提升大企业复杂涉税事项的管理层级，促进税收征管整体资源的优化配置。
在组织实施风险应对时，要按纳税人区域、规模和特定事项等要素，合理确定风险应对层级和承办部门。（    ）|正确|错误||||1|||||P-191|P-191
