Question|Option1|Option2|Option3|Option4|Option5|Answer1|Answer2|Answer3|Answer4|Answer5|Notes|xNotes
在税收风险管理过程中要创新大企业管理，实现重点突破。要强化税务省、市税务机关两级统筹，提升复杂事项管理层级。（    ）|正确|错误||||2|||||P-292在税收风险管理过程中要创新大企业管理，实现重点突破。要强化税务总局、省税务机关两级统筹，提升复杂事项管理层级。|P-292在税收风险管理过程中要创新大企业管理，实现重点突破。要强化税务总局、省税务机关两级统筹，提升复杂事项管理层级。
税收数据情报管理是指税务机关对税收数据信息情报的采集、加工、分析、知识管理工作。（    ）|正确|错误||||2|||||P-296 税收数据情报管理是指税务机关税收数据信息情报的采集、加工、分析、情报交换、知识管理等工作。|P-296 税收数据情报管理是指税务机关税收数据信息情报的采集、加工、分析、情报交换、知识管理等工作。
情报：指在税收征管活动中，对解决特定税收征管问题具有决策支撑作用的数据信息，具有知识性、传递性和效用性。（   ）|正确|错误||||1|||||P-296|P-296
数据采集是指实现对内、外部不同来源的数据接入信息平台进行存储, 并与税务机关核心业务数据融为一体，便于数据的进一步加工。主要包括各 内部系统数据抽取、第三方信息导入、日常信息采集等功能。（    ）|正确|错误||||1|||||P-299|P-299
行业评估模型的建立首先必须通过全面准确采集、科学有效分析和监控行业指标，并结合纳税人的申报信息所产生的涉税指标，实现行业风险指标和涉税指标的有机结合和互相制约，从而建立有针对性和准确性的行业风险指标体系。（    ）|正确|错误||||1|||||P-308|P-308
范某2016年10月以其所有的一项专利技术投资作价80万元入股甲企业，获得甲企业股票40万股，占企业股本的6%。若范某发明该项专利技术的成本为15万元，入股时发生评估费及其他合理税费共3万元。假设后来范某将这部分股权以150万元卖掉，转让时发生税费2万元，范某选择递延纳税。问：应如何计算纳税？答：范某入股当期无需缴税。待范某转让该部分股权时一次性缴税，转让时应纳税额=【150万元-（15万元+3万元）-2万元】*20%=26万元。|正确|错误||||1||||||
