Question|Option1|Option2|Option3|Option4|Option5|Answer1|Answer2|Answer3|Answer4|Answer5|Notes|xNotes
企业持有的固定资产，单位价值不超过（    ）的，可以一次性在计算应纳税所得额时扣除。|5000元|50000元|2000元|20000元||1|||||征管评估P250企业持有的固定资产，单位价值不超过5000元的，可以一次性在计算应纳税所得额时扣除。企业在2013年12月31日前持有的单位价值不超过5000元的固定资产，其折余价值部分，2014年1月1日以后可以一次性在计算应纳税所得额时扣除。|征管评估P250企业持有的固定资产，单位价值不超过5000元的，可以一次性在计算应纳税所得额时扣除。企业在2013年12月31日前持有的单位价值不超过5000元的固定资产，其折余价值部分，2014年1月1日以后可以一次性在计算应纳税所得额时扣除。
《企业所得税法实施条例》第六十四条规定：生产性生物资产计算折旧的最低年限如下：林木类生产性生物资产，为（    ）年。|10年|20年|5年|3年||1|||||征管评估P251《企业所得税法实施条例》第六十四条规定：生产性生物资产计算折旧的最低年限如下：林木类生产性生物资产，为10年；畜类生产性生物资产，为3年。|征管评估P251《企业所得税法实施条例》第六十四条规定：生产性生物资产计算折旧的最低年限如下：林木类生产性生物资产，为10年；畜类生产性生物资产，为3年。
开办费按照规定可以在企业开始经营之日的当年一次扣除，也可以从企业开始经营之日的当年起，按照不少于（    ）年进行摊销。 |10年|20年|5年|3年||4|||||征管评估P252开办费按照规定可以在企业开始经营之日的当年一次扣除，也可以从企业开始经营之日的当年起，按照不少于3年进行摊销。|征管评估P252开办费按照规定可以在企业开始经营之日的当年一次扣除，也可以从企业开始经营之日的当年起，按照不少于3年进行摊销。
按照现行税法规定，房屋、建筑物计算折旧的最低年限是（    ）：|10年|20年|5年|3年||2|||||征管评估P249固定资产折旧年限的规定《企业所得税法实施条例》第六十条规定，除国务院财政、税务主管部门另有规定外，固定资产计算折旧的最低年限如下：房屋、建筑物，为20年；飞机、火车、轮船、机器、机械和其他生产设备，为10年；与生产经营活动有关的器具、工具、家具等，为5年；飞机、火车、轮船以外的运输工具，为4年；电子设备，为3年。|征管评估P249固定资产折旧年限的规定《企业所得税法实施条例》第六十条规定，除国务院财政、税务主管部门另有规定外，固定资产计算折旧的最低年限如下：房屋、建筑物，为20年；飞机、火车、轮船、机器、机械和其他生产设备，为10年；与生产经营活动有关的器具、工具、家具等，为5年；飞机、火车、轮船以外的运输工具，为4年；电子设备，为3年。
生产性生物资产，是指为产出农产品、提供劳务或出租等目的而持有的生物资产，不包括（    ）。|景观林|薪炭林|产畜|役畜||1|||||征管评估P251生产性生物资产的折旧与审核生产性生物资产，是指为产出农产品、提供劳务或出租等目的而持有的生物资产，包括经济林、薪炭林、产畜和役畜等。|征管评估P251生产性生物资产的折旧与审核生产性生物资产，是指为产出农产品、提供劳务或出租等目的而持有的生物资产，包括经济林、薪炭林、产畜和役畜等。
企业取得投资上市公司股票取得的现金红利，应以（    ）的日期，确定收入的实现。|股东大会作出利润分配决定|董事会通过利润分配计划|企业收到现金红利|企业收到上市公司派发红利的通知||1|||||公共书P101除国务院财政、税务主管部门另有规定外，按照被投资方做出利润分配决定的日期确认收入的实现。|公共书P101除国务院财政、税务主管部门另有规定外，按照被投资方做出利润分配决定的日期确认收入的实现。
根据税法规定，投资企业从被投资企业撤回或减少投资，其取得的资产中，（    ）|相当于被投资企业累计未分配利润和累计盈余公积按减少实收资本比例计算的部分，应确认为股息所得|全部确认为投资资产转让所得|全部确认为股息所得|扣除相当于初始出资的部分，确认为投资资产转让所得||1|||||征管评估P256《国家税务总局关于企业所得税若干问题的公告》（国家税务总局公告2011年第34号）规定，投资企业从被投资企业撤回或减少投资，其取得的资产中，相当于初始出资的部分，应确认为投资收回；相当于被投资企业累计未分配利润和累计盈余公积按减少实收资本比例计算的部分，应确认为股息所得；其余部分确认为投资资产转让所得。|征管评估P256《国家税务总局关于企业所得税若干问题的公告》（国家税务总局公告2011年第34号）规定，投资企业从被投资企业撤回或减少投资，其取得的资产中，相当于初始出资的部分，应确认为投资收回；相当于被投资企业累计未分配利润和累计盈余公积按减少实收资本比例计算的部分，应确认为股息所得；其余部分确认为投资资产转让所得。
下列各项中，税收规定可以在税前扣除的项目是（    ）|违法经营的罚款|各种税收的滞纳金、罚金和罚款|各项赞助支出|违反经济合同支付的违约金||4|||||公共书P102 1.在计算应纳税所得额时，下列支出不得扣除：（1）向投资者支付的股息、红利等权益性投资收益款项；（2）企业所得税税款；（3）税收滞纳金；（4）罚金、罚款和被没收财物的损失；（5）准予扣除的公益性捐赠支出以外的捐赠支出；（6）赞助支出；（7）未经核定的准备金支出；|公共书P102 1.在计算应纳税所得额时，下列支出不得扣除：（1）向投资者支付的股息、红利等权益性投资收益款项；（2）企业所得税税款；（3）税收滞纳金；（4）罚金、罚款和被没收财物的损失；（5）准予扣除的公益性捐赠支出以外的捐赠支出；（6）赞助支出；（7）未经核定的准备金支出；
发生以下情形，不适用税收担保的是（   ）。|欠缴税款、滞纳金的纳税人或者其法定代表人需要出境的|已经被税务稽查部门依法立案或司法机关立案查处的|纳税人同税务机关在纳税上发生争议而未缴清税款，需要申请行政复议的|发务机关有根据认为从事生产、经营的纳税人有逃避纳税义务行为，在规定的纳税期之前经责令其限期缴纳应纳税款，在限期内发现纳税人有明显的转移、隐匿其应纳税的商品、货物以及其他财产或者应纳税收入的迹象，责成纳税人提供纳税担保的||2|||||征管评估P259已经被税务稽查部门依法立案或司法机关立案查处的应是终结纳税评估|征管评估P259已经被税务稽查部门依法立案或司法机关立案查处的应是终结纳税评估
下列属于税收保全财产范围的是（    ）。|机动车辆、金银饰品、古玩字画、豪华住宅|单价5000元以下的其他生活用品，|个人及其所扶养家属维持生活必需的住房和用品|个人唯一住房||1|||||征管评估P264（三）税收保全的财产范围1.纳税人的财产，包括纳税人的房地产、现金、有价证券等不动产和动产。机动车辆、金银饰品、古玩字画、豪华住宅或者一处以外的住房不属于税收征管法第三十八条、第四十条、第四十二条所称个人及其所扶养家属维持生活必需的住房和用品。税务机关对单价5000元以下的其他生活用品，不采取税收保全措施和强制执行措施。2.个人及其所扶养家属维持生活必需的住房和用品，不在税收保全措施的范围之内。|征管评估P264（三）税收保全的财产范围1.纳税人的财产，包括纳税人的房地产、现金、有价证券等不动产和动产。机动车辆、金银饰品、古玩字画、豪华住宅或者一处以外的住房不属于税收征管法第三十八条、第四十条、第四十二条所称个人及其所扶养家属维持生活必需的住房和用品。税务机关对单价5000元以下的其他生活用品，不采取税收保全措施和强制执行措施。2.个人及其所扶养家属维持生活必需的住房和用品，不在税收保全措施的范围之内。
实施税收保全措施，必须经（    ）局长批准|县以上税务局（分局）|地级市以上税务局（分局）|市以上税务局（分局）|省、直辖市税务局||1|||||征管评估P264|征管评估P264
税收保全措施适用于（   ）。|所有纳税人|自然人纳税人|增值税一般纳税人|从事生产经营的纳税人||4|||||征管评估P263（二）税收保全的适用条件:（1）只适用于从事生产经营的纳税人；|征管评估P263（二）税收保全的适用条件:（1）只适用于从事生产经营的纳税人；
税务机关对（    ）以下的其他生活用品，不采取税收保全措施和强制执行措施。|合计5000元|单价5000元|合计10000元|单价10000元||2|||||征管评估P264税务机关对单价5000元以下的其他生活用品，不采取税收保全措施和强制执行措施。2.个人及其所扶养家属维持生活必需的住房和用品，不在税收保全措施的范围之内。|征管评估P264税务机关对单价5000元以下的其他生活用品，不采取税收保全措施和强制执行措施。2.个人及其所扶养家属维持生活必需的住房和用品，不在税收保全措施的范围之内。
在纳税评估的准备、实施和处理阶段，如果发现特定纳税人的税款存在无法征收的风险，为防止税款流失，应当及时要求纳税人提供纳税担保。纳税担保范围不包括（    ）。|税款|滞纳金|罚款实现|实现滞纳金的费用||3|||||征管评估P263纳税担保范围包括税款、滞纳金和实现税款、滞纳金的费用。费用包括抵押、质押登记费用，质押保管费用，以及保管、拍卖、变卖担保财产等相关费用支出。|征管评估P263纳税担保范围包括税款、滞纳金和实现税款、滞纳金的费用。费用包括抵押、质押登记费用，质押保管费用，以及保管、拍卖、变卖担保财产等相关费用支出。
经评估分析、税务约谈、实地核查，发现企业与境外关联企业间存在不按照独立企业交易原则进行交易往来，以及其他问题需要由专业部门进一步调查和处理的，由评估人员在《纳税评估报告》中应建议（   ）。|移送稽查|移送其他部门|提请纳税人自行改正|移送上级机关||2|||||征管评估P265经评估分析、税务约谈、实地核查，发现企业与境外关联企业间存在不按照独立企业交易原则进行交易往来，以及其他问题需要由专业部门进一步调查和处理的，由评估人员在《纳税评估报告》中提出“移送其他部门”处理建议；|征管评估P265经评估分析、税务约谈、实地核查，发现企业与境外关联企业间存在不按照独立企业交易原则进行交易往来，以及其他问题需要由专业部门进一步调查和处理的，由评估人员在《纳税评估报告》中提出“移送其他部门”处理建议；
纳税人主动选择以自查申报代替约谈说明后，未能在规定期限内自查补税且未向税务机关说明正当理由的，以及自查补税结果与税务机关的评估结果差距较大且不能说明正当理由的，在纳税评估报告中应建议（    ）。|移送稽查|移送其他部门|提请纳税人自行改正|移送上级机关||1|||||征管评估P264属于下列情形之一的，由评估人员在《纳税评估报告》中提出“移送稽查”处理建议：①明显存在虚开或接受虚开发票现象的； ②纳税人拒绝评估人员纳税评估实地核查，或者以各种方式阻挠、刁难评估人员核查的；③纳税人主动选择以自查申报代替约谈说明后，未能在规定期限内自查补税且未向税务机关说明正当理由的，以及自查补税结果与税务机关的评估结果差距较大且不能说明正当理由的；④纳税评估过程中发现纳税人涉嫌逃税、抗税、逃避追缴欠税、骗取出口退税行为之一的；⑤其它需移交稽查的情形。|征管评估P264属于下列情形之一的，由评估人员在《纳税评估报告》中提出“移送稽查”处理建议：①明显存在虚开或接受虚开发票现象的； ②纳税人拒绝评估人员纳税评估实地核查，或者以各种方式阻挠、刁难评估人员核查的；③纳税人主动选择以自查申报代替约谈说明后，未能在规定期限内自查补税且未向税务机关说明正当理由的，以及自查补税结果与税务机关的评估结果差距较大且不能说明正当理由的；④纳税评估过程中发现纳税人涉嫌逃税、抗税、逃避追缴欠税、骗取出口退税行为之一的；⑤其它需移交稽查的情形。
《纳税评估报告》不包括以下主要内容（    ）|纳税评估对象的基本情况|评估确定的主要疑点和问题|评估基本情况|稽查建议||4|||||征管评估P264《纳税评估报告》应包括以下主要内容：（1）纳税评估对象的基本情况；（2）评估确定的主要疑点和问题；（3）评估基本情况；（4）认定结论；（5）评估详细情况；（6）处理建议；（7）征管建议。|征管评估P264《纳税评估报告》应包括以下主要内容：（1）纳税评估对象的基本情况；（2）评估确定的主要疑点和问题；（3）评估基本情况；（4）认定结论；（5）评估详细情况；（6）处理建议；（7）征管建议。
当纳税人拒绝接收文书时适用（    ）方式。|留置送达|直接送达|邮寄送达|委托送达||1|||||征管评估P266|征管评估P266
税务文书送达有5种方式，其中，最基本的送方式是（    ）。|留置送达|直接送达|邮寄送达|委托送达||2|||||征管评估P266|征管评估P266
采用公告送达税务文书的，自公告之日起满（    ），即视为送达。|10日|15日|20日|30日||4|||||征管评估P267|征管评估P267
公告送达税务文书适用于（    ）|当受送达人拒绝接收文书时适用|受送达人被监禁或被劳动教养|当送达对象人数众多或下落不明时适用|适用于各种情形||3|||||征管评估P267公告送达方式中的注意事项：在受送达对象数量众多、成分复杂、分布广泛的情况下，采用其他送达方式将很难实现，税务机关应采用公告送达方式，这样可以减少直接送达所带来的不便，节约大量的税收成本。|征管评估P267公告送达方式中的注意事项：在受送达对象数量众多、成分复杂、分布广泛的情况下，采用其他送达方式将很难实现，税务机关应采用公告送达方式，这样可以减少直接送达所带来的不便，节约大量的税收成本。
下列有关税务行政处罚的陈述，错误的是（    ）|确有应受行政处罚的违法行为的，根据情节轻重及具体情况，作出行政处罚决定，并制作《税务行政处罚决定书》|违法行为轻微，依法可以不予行政处罚的，不予行政处罚，并制作《不予行政处罚决定书》；|违法事实不能成立的，不得给予行政处罚，并制作《不予行政处罚决定书》|《税务行政处罚决定书》或者《不予行政处罚决定书》应当按征管法及实施细则的规定送达给当事人。||3|||||征管评估P271（5）作出处罚决定并送达 税务机关根据不同情况，应当分别作出以下决定：确有应受行政处罚的违法行为的，根据情节轻重及具体情况，作出行政处罚决定，并制作《税务行政处罚决定书》；违法行为轻微，依法可以不予行政处罚的，不予行政处罚，并制作《不予行政处罚决定书》；违法事实不能成立的，不得给予行政处罚；《税务行政处罚决定书》或者《不予行政处罚决定书》应当按征管法及实施细则的规定送达给当事人。|征管评估P271（5）作出处罚决定并送达 税务机关根据不同情况，应当分别作出以下决定：确有应受行政处罚的违法行为的，根据情节轻重及具体情况，作出行政处罚决定，并制作《税务行政处罚决定书》；违法行为轻微，依法可以不予行政处罚的，不予行政处罚，并制作《不予行政处罚决定书》；违法事实不能成立的，不得给予行政处罚；《税务行政处罚决定书》或者《不予行政处罚决定书》应当按征管法及实施细则的规定送达给当事人。
依据《税收征管法》第八十六条规定，对违反税收法律、行政法规应当给予行政处罚的行为，在（    ）年内未被发现的，不再给予行政处罚。|三年|五年|八年|十年||2|||||征管评估P269|征管评估P269
在纳税评估中，对法人和其他组织处以（    ）以下罚款或者警告的行政处罚的，可以当场作出行政处罚决定。|2000元（含）|2000元（不含）|1000元（含）|1000元（不含）||3|||||征管评估P269在纳税评估中，违法事实确凿并有法定依据，对公民处以50元（含）以下、对法人和其他组织处以1000元（含）以下罚款或者警告的行政处罚的，可以当场作出行政处罚决定。|征管评估P269在纳税评估中，违法事实确凿并有法定依据，对公民处以50元（含）以下、对法人和其他组织处以1000元（含）以下罚款或者警告的行政处罚的，可以当场作出行政处罚决定。
在纳税评估中，对公民处以（    ）以下罚款或者警告的行政处罚的，可以当场作出行政处罚决定。|100元（含）|100元（不含）|50元（含）|50元（不含）||3|||||征管评估P269在纳税评估中，违法事实确凿并有法定依据，对公民处以50元（含）以下、对法人和其他组织处以1000元（含）以下罚款或者警告的行政处罚的，可以当场作出行政处罚决定。|征管评估P269在纳税评估中，违法事实确凿并有法定依据，对公民处以50元（含）以下、对法人和其他组织处以1000元（含）以下罚款或者警告的行政处罚的，可以当场作出行政处罚决定。
对公民处以2000元（含）以上、对法人或其他组织处以１万元（含）以上罚款的税务行政处罚，还应告知纳税人及相关方有（    ）。|陈述权|申辩权|要求举行听证的权利|要求举证的权利||3|||||征管评估P269同时，对公民处以2000元（含）以上、对法人或其他组织处以1万元（含）以上罚款的税务行政处罚，还应告知纳税人及相关方有要求举行听证的权利。|征管评估P269同时，对公民处以2000元（含）以上、对法人或其他组织处以1万元（含）以上罚款的税务行政处罚，还应告知纳税人及相关方有要求举行听证的权利。
当事人要求陈述、申辩的，检查人员应当听取当事人的陈述申辩，当事人应在收到税务行政处罚告知事项之日起（    ）内向税务机关陈述、申辩，进行陈述、申辩可以采取口头形式或书面形式。|3日|5日|7日|10日||1|||||征管评估P270|征管评估P270
筹资活动产生的现金流量与企业所得税有较大的关系。筹资包括吸收投资和借款，以下不属于筹资活动审核分析内容的是（    ）|检查筹资费用的支付是否合理|利息的列支是否符合税法的规定|“分配股利、利润和偿付利息所支付的现金”项目的检查要结合有关明细账进行分析检查并要审阅相关的股东大会的文件、借款协议，更加可靠地确定费用列支的合理性|涉及增值税的是固定资产的购买和处置，对购买的固定资产检查其增值税是否列入了进项税额（税法规定的可以抵扣的情况除外）||4|||||征管评估P289筹资包括吸收投资和借款，要检查筹资费用的支付是否合理，利息的列支是否符合税法的规定。特别对“分配股利、利润和偿付利息所支付的现金”项目的检查要结合有关明细账进行分析检查并要审阅相关的股东大会的文件、借款协议，更加可靠地确定费用列支的合理性。|征管评估P289筹资包括吸收投资和借款，要检查筹资费用的支付是否合理，利息的列支是否符合税法的规定。特别对“分配股利、利润和偿付利息所支付的现金”项目的检查要结合有关明细账进行分析检查并要审阅相关的股东大会的文件、借款协议，更加可靠地确定费用列支的合理性。
税务机关在收到申请（    ）内，对听证申请作出裁决，不符合法律、法规规定的，不予受理。|5日|7日|10日|15日||4|||||征管评估P270|征管评估P270
税务机关在责令限期缴纳时，应当发出限期缴纳税款通知书，责令缴纳或者解缴税款的最长期限不得超过（     ）。|5日|10日|15日|20日||3|||||征管评估P273|征管评估P273
税收强制执行措施必须发生在（    ）之后，责令限期内有逃避履行纳税义务迹象的，税务机关应采取的是税收保全措施。|税收保全措施|责令限期缴纳期满|举行听证|纳税人、扣缴义务陈述申辩||2|||||征管评估P273|征管评估P273
追征实施中主张优先权工作目标是欠税追征人员对符合行使优先权的欠税纳税人，经审批同意后向（    ）提出申请，行使优先权。|上级机关|稽查部门|人民法院|公安部门||3|||||征管评估P274|征管评估P274
以下关于听证费的说法正确的是（    ）。|听证费用由组织听证的税务机关支付|听证费用由申请举行听证的纳税人支付|听证费用由参加听证的税务机关支付|听证费用无需支付||1|||||征管评估P271听证费用由组织听证的税务机关支付。|征管评估P271听证费用由组织听证的税务机关支付。
行政机关作出行政处罚（一般）决定之前，应当告知当事人有要求举行听证的权利；当事人要求听证的，行政机关应当组织听证。但以下哪项表述不准确（    ）。|责令停产停业|吊销许可证|吊销执照|罚款||4|||||征管评估P270根据《中华人民共和国行政处罚法》的规定，行政机关作出责令停产停业、吊销许可证或者执照、较大数额罚款等行政处罚决定之前，应当告知当事人有要求举行听证的权利；当事人要求听证的，行政机关应当组织听证。|征管评估P270根据《中华人民共和国行政处罚法》的规定，行政机关作出责令停产停业、吊销许可证或者执照、较大数额罚款等行政处罚决定之前，应当告知当事人有要求举行听证的权利；当事人要求听证的，行政机关应当组织听证。
下列税收代位权行使要件不正确的是（    ）|纳税人欠缴税款|纳税人怠于行使到期债权|纳税人怠于行使权利的行为已经对国家税收造成损害|客体是一般财产为给付内容的债权||4|||||征管p275根据《最高人民法院关于适用（中华人民共和国合同法）若干问题的解释（一）》（以下简称《解释》）第十三条的规定，债权人可就债务人享有的具有金钱给付内容的到期债权行使代位权。这一规定实际上将以一般财产为给付内容的债权排除在代位权客体之外。|征管p275根据《最高人民法院关于适用（中华人民共和国合同法）若干问题的解释（一）》（以下简称《解释》）第十三条的规定，债权人可就债务人享有的具有金钱给付内容的到期债权行使代位权。这一规定实际上将以一般财产为给付内容的债权排除在代位权客体之外。
听证会由税务机关负责人指定的非本案调查机构的人员主持，当事人、本案调查人员及其他有关人员参加。当事人认为听证主持人与本案有直接利害关系的，有权申请回避。回避申请，应当在举行听证的（    ）前向税务机关提出，并说明理由。|1日|3日|5日|7日||2|||||征管p270听证会由税务机关负责人指定的非本案调查机构的人员主持，当事人、本案调查人员及其他有关人员参加。当事人认为听证主持人与本案有直接利害关系的，有权申请回避。回避申请，应当在举行听证的3日前向税务机关提出，并说明理由。|征管p270听证会由税务机关负责人指定的非本案调查机构的人员主持，当事人、本案调查人员及其他有关人员参加。当事人认为听证主持人与本案有直接利害关系的，有权申请回避。回避申请，应当在举行听证的3日前向税务机关提出，并说明理由。
