Question|Option1|Option2|Option3|Option4|Option5|Answer1|Answer2|Answer3|Answer4|Answer5|Notes|xNotes
关于一般纳税人资格登记，以下说法错误的是：（   ）|营改增试点实施前已取得增值税一般纳税人资格并兼有应税行为的试点纳税人，不需要重新办理增值税一般纳税人资格登记手续，由主管国税机关制作、送达《税务事项通知书》，告知纳税人。|营改增试点实施前应税行为年应税销售额未超过500万元的试点纳税人，会计核算健全，能够提供准确税务资料的，也可以向主管国税机关办理增值税一般纳税人资格登记。|营改增试点实施前，试点纳税人增值税一般纳税人资格登记可由省国税局采取预登记措施。|营改增试点实施后，符合条件的试点纳税人应当办理增值税一般纳税人资格登记。按照营改增有关规定，应税行为有扣除项目的试点纳税人，其应税行为年应税销售额按扣除之后的销售额计算。||4||||||
主管税务机关可以在一定期限内，对发生增值税偷税数额占应纳税额的10%以上并且偷税数额在10 万元以上的、骗取出口退税的、虚开增值税扣税凭证的，或者国家税务总局规定的其他情形的增值税一般纳税人实行不少于（   ）的纳税辅导期管理。|一个月|三个月|六个月|十二个月||3||||||
以下不能办理一般纳税人简易办法征收备案的是：（   ）|一般纳税人提供的公共交通运输服务|一般纳税人以纳入营改增试点之日后取得的有形动产为标的物提供的经营租赁服务|一般纳税人为甲供工程提供的建筑服务|一般纳税人提供劳务派遣服务||2||||||
《增值税预缴税款表》中销售不动产的预征率为：（   ）|2%|3%|5%|1.5%||2||||||
以下关于企业所得税季度预缴的说法错误的是：（   ）|建筑企业总机构直接管理的跨地区设立的项目部，应按项目实际经营收入的2%按月或按季由总机构向项目所在地预分企业所得税，并由项目部向主管税务机关预缴。|小型微利企业符合享受优惠政策条件，但预缴时未享受的，在年度汇算清缴时统一计算享受。小型微利企业在预缴时享受了优惠政策，但年度汇算清缴时超过规定标准的，应按规定补缴税款。|按照企业所得税核定征收办法缴纳企业所得税的居民企业依照税收法律、法规、规章及其他有关企业所得税的规定，在规定的纳税期限内向税务机关提交《中华人民共和国企业所得税月（季）度预缴纳税申报表（B 类，2015 年版）》及其他相关资料，进行月（季）度预缴纳税申报。|月（季）度预缴纳税申报期限为月份或者季度终了之日起的15 日内，遇最后一日是法定休假日的，以休假日期满的次日为期限的最后一日；在期限内有连续3 日以上法定休假日的，按休假日天数顺延。||1|||||p142建筑企业总机构直接管理的跨地区设立的项目部，应按项目实际经营收入的0.2%按月或按季由总机构向项目所在地预分企业所得税，并由项目部向主管税务机关预缴。|p142建筑企业总机构直接管理的跨地区设立的项目部，应按项目实际经营收入的0.2%按月或按季由总机构向项目所在地预分企业所得税，并由项目部向主管税务机关预缴。
政策性搬迁企业，应当自搬迁开始年度，至次年5月31日前，向税务机关（    ）报送“政府搬迁文件或公告”“搬迁重置总体规划”“拆迁补偿协议”“资产处置计划”“其他与搬迁相关的事项”。|迁入地|迁出地和迁入地|迁出地|迁出地或迁入地||2||||||
因解散、破产、重组等原因终止生产经营活动，或不再持续经营，需依法对资产、债权、债务进行清算的居民企业，应当在办理注销登记之前，以整个清算期间作为一个纳税年度，依法计算清算所得及其应纳所得税，自清算结束之日起（  ）内，向税务机关报送《中华人民共和国企业清算所得税申报表》及附表、其他相关资料，进行纳税申报。企业在办理所得税清算申报前，应当自实际经营终止之日起（  ）内，先向主管税务机关办理年度企业所得税汇算清缴，依法缴纳企业所得税。（    ）|15 日60日|15 日 30日|30 日60日|30 日 30日||1||||||
下列关于合伙企业个人所得税申报的说法中错误的是：（    ）|投资兴办两个或两个以上企业，并且其中含有合伙企业的投资者，应依照税收法律、法规、规章及其他有关规定，在年度终了后3 0日内，应填报《个人所得税生产经营所得纳税申报表（C 表）》，汇总从所有企业取得的应纳税所得额，据此确定适用税率并计算缴纳应纳税款，向税务机关进行纳税申报。|合伙企业投资者应向经常居住地主管税务机关申报纳税，办理汇算清缴，但经常居住地与其兴办企业的经营管理所在地不一致的，应选定其参与兴办的某一合伙企业的经营管理所在地为办理年度汇算清缴所在地。|合伙企业因在纳税年度中间开业、合并、注销及其他原因，导致该纳税年度的实际经营期不足1年的，对合伙企业自然人合伙人的生产经营所得计算个人所得税时，以其实际经营期为1个纳税年度，其本人的费用扣除标准，应按照其实际经营月份数，以每月3500元的减除标准确定。|合伙企业投资者在中国境内两处或者两处以上取得“个体工商户的生产、经营所得”和“对企事业单位的承包经营、承租经营所得”的，同项所得合并计算纳税的个人所得税年度汇总纳税申报。||1|||||p145投资兴办两个或两个以上企业，并且其中含有合伙企业的投资者，应依照税收法律、法规、规章及其他有关规定，在年度终了后3 个月内，应填报《个人所得税生产经营所得纳税申报表（C 表）》，汇总从所有企业取得的应纳税所得额，据此确定适用税率并计算缴纳应纳税款，向税务机关进行纳税申报。|p145投资兴办两个或两个以上企业，并且其中含有合伙企业的投资者，应依照税收法律、法规、规章及其他有关规定，在年度终了后3 个月内，应填报《个人所得税生产经营所得纳税申报表（C 表）》，汇总从所有企业取得的应纳税所得额，据此确定适用税率并计算缴纳应纳税款，向税务机关进行纳税申报。
以下哪项不是纳税人应进行土地增值清算的条件：（    ）|房地产开发项目全部竣工、完成销售的； |整体转让未竣工决算房地产开发项目的； |直接转让土地使用权的。|取得预售许可证满3年||4||||||
对于白酒生产企业销售给销售单位的白酒，生产企业消费税计税价格低于销售单位对外销售价格（不含增值税）（    ）以下的，税务机关应核定消费税最低计税价格。|30%|50%|70%|90%||3||||||
根据《企业所得税核定征收办法（试行）》第十一条规定，税务机关应在每年（    ）前对上年度实行核定征收企业所得税的纳税人进行重新鉴定，重新核定应纳企业所得税额或应税所得率。|1月底|3月底 |5月底 |6月底||4||||||
以下哪种情况不属于税务机关有权核定企业的应纳税额（    ）|依照法律、行政法规的规定应当设置账簿但未设置的|虽设置账簿，但账目混乱或者成本资料、收入凭证、费用凭证残缺不全，难以查账的|发生纳税义务，未按照规定的期限办理纳税申报，经税务机关责令限期申报，逾期仍不申报的|纳税人申报的计税依据偏低，且有正当理由的||4||||||
税务机关核定非居民企业的利润率，以下错误的是（    ）|从事承包工程作业、设计和咨询劳务的，利润率为15%～30%|从事管理服务的，利润率为30%～50%|从事其他劳务或劳务以外经营活动的，利润率不低于30%|税务机关有根据认为非居民企业的实际利润率明显高于上述标准的，可以按照比上述标准更高的利润率核定其应纳税所得额||3|||||p152从事其他劳务或劳务以外经营活动的，利润率不低于15%|p152从事其他劳务或劳务以外经营活动的，利润率不低于15%
以下哪个项目属于增值税减免直接申报的项目（    ）|鲜活肉蛋产品免征增值税优惠|技术转让、技术开发免征增值税优惠|动漫企业增值税即征即退|小微企业免征增值税优惠||4||||||
因城市实施规划、国家建设需要而搬迁，纳税人自行转让房地产（   ）土地增值税。|减半征收|免征|全额征收|定额减免||2||||||
将税务文书送达给文书受送达人，受送达人是法人的，按规定（   ）不能签收。|法定代表人|财务负责人|见证人|代理人||3||||||
复议机关应当自受理申请之日起（）日内作出行政复议决定；情况复杂，不能在规定期限内作出行政复议决定的，经复议机关负责人批准，可以适当延长，并告知申请人和被申请人；但延长期限最多不超过（     ）日。|60 15|30 15|60 30|90 30||3||||||
对违反规定发生被盗、丢失专用发票的纳税人，主管税务机关必须严格按《中华人民共和国税收征收管理法》和《中华人民共和国发票管理办法》的规定，处以（） 以下的罚款，并可视具体情况，对丢失专用发票的纳税人，在最长不超过（     ）时限内，停止领用专用发票。|1万元 三个月|1万元  半年 |5000元  三个月|5000元  半年||2||||||
对增值税一般纳税人发生真实交易但由于客观原因造成（    ）以后开具的增值税扣税凭证未能按照规定期限办理认证或者稽核比对的，经主管税务机关审核、逐级上报，由国家税务总局认证、稽核比对后，对比对相符的增值税扣税凭证，允许纳税人继续抵扣其进项税额。|2007年1月1日|2008年1月1日|2009年1月1日|2010年1月1日||1||||||
实行全员全额扣缴申报地区的税务机关应于年度终了3个月内，为已经实行扣缴申报后的个人按其全年实际缴纳的个人所得税额开具（    ）|《税收完税证明（文书式）》|《税收完税证明（表格式）》|《税收缴款书（代扣代收专用）》|《税收电子缴款书》||1||||||
根据《全国税务机关出口退（免）税管理工作规范（1.1版）》规定，国税机关应设置申报受理岗、审核岗、调查评估岗、复审岗、（    ）、预警分析岗、综合管理岗、信息管理岗和系统维护岗等岗位。|审批岗|核准岗|开票岗|核验岗||2||||||
根据《全国税务机关出口退（免）税管理工作规范（1.1版）》规定，综合管理岗应在开具《税收收入退还书》后的（    ）内，将其送交国库办理退库，并在收到国库返回的退库凭证相应联次后的1个工作日内进行销号处理。|5日|5个工作日|2日|2个工作日||4||||||
根据《全国税务机关出口退（免）税管理工作规范（1.1版）》规定，首次申报《进料加工企业计划分配率备案表》的，申报受理岗应核对备案表中填报的进料加工备案（   ），与企业报送的相关资料内容相符的予以备案。|计划分配率|实际分配率|核销分配率|预计分配率||1||||||
（   ），是指主管税收工作的职能部门或其他机关，依法代表国家对税收分配的全过程进行计划、组织、协调和监督的工作，旨在保证财政收入及时足额入库，以充分发挥税收对经济的调节作用。|税收管理|纳税遵从|纳税服务|税收征管||1||||||
狭义的税收管理是税务机关围绕（   ）所实施的管理活动的总称|纳税遵从 |税收征管|纳税服务|税收目标||1||||||
国内对税收管理制度“三十四字”方针的提出处于（   ）阶段|税收管理员制度阶段 |“征、管、查”三分离阶段|“信息管税＋专业化管理”阶段|全面推进税收管理现代化阶段||1||||||
（   ）是指以纳税人需求为导向，以信息技术为依托，以风险控制为手段，旨在降低征税成本提高征管效能，最终实现纳税遵从的一组相互关联、相互作用的税收管理活动总和。|税收管理流程 |税收管理基本流程|税收风险管理流程|税收征管流程||1||||||
不属于税收风险管理的全流程范围的是（    ）|后续管理 |目标规划|评价反馈|信息收集||1||||||
（   ）是整个风险管理的核心。|风险应对 |风险识别|目标规划|风险等级排序||1||||||
不属于税收数据情报管理的四项工作内容的是（    ）|汇总数据情报工作 |搜集数据情报工作|数据情报研究工作|数据情报风险推送工作||1|||||p202“四项工作” 是指：搜集数据情报工作、建立数据情报库工作、数据情报研究工作以及数据情报风险推送工作。|p202“四项工作” 是指：搜集数据情报工作、建立数据情报库工作、数据情报研究工作以及数据情报风险推送工作。
（   ）是税务机关对纳税人的申报情况进行核实的过程，在整个税收管理基本流程中处于核心地位。|纳税评估|税务稽查|纳税服务|税务审计||1||||||
将税收风险等级由低到高进行排序，税收风险应对策略的类型依次可分为（   ）|风险提醒、纳税评估、税务审计和反避税调查、税务稽查|风险提醒、纳税评估、税务稽查、税务审计和反避税调查|纳税评估、税务审计和反避税调查、风险提醒、税务稽查|风险提醒、纳税服务、纳税评估、税务稽查||1||||||
不属于税款追征的主要特点的是：（    ）|征收程序具有单方面性|税款追征是对税收债务的追征|债务追征的强制性更加突出|主张税收债权也具有时效性||1|||||p205税款追征的主要特点：1、税款追征是对税收债务的追征2、征收程序具有双重性3、债务追征的强制性更加突出4、主张税收债权也具有时效性|p205税款追征的主要特点：1、税款追征是对税收债务的追征2、征收程序具有双重性3、债务追征的强制性更加突出4、主张税收债权也具有时效性
税收数据情报管理是将税收情报通过采集、分析、处理、传递和应用等过程，形成有关管理的流程，它由（     ）三个要素决定。|机构、信息库和技术|机构、数据和技术|信息库、数据和技术|机构、信息库和数据||1||||||
以下哪一项现代税收管理方式的特征是指将风险管理的理念和方法全面运用于税收管理，风险分析识别库覆盖全行业、归集全项目、整合全指标、聚焦高风险。（   ）|科学化|信息化|集约化|专业化||1||||||
（   ）是依据国家税收法律和法规的规定，以现代信息技术和网络为依托，以提高纳税遵从为主要目标，通过加强与政府相关部门、行业协会、社区、中介等其他社会组织之间合作，从根本上堵塞税收征管漏洞，在客观上最大限度减少税收流失，缩短实际税收收入与理论值差距的重要手段。|综合治税|税收风险管理|信息管税|分类分级管理||1||||||
在税务机关的机构设置上，体现“分类”要求的机构设置主要是（   ）机构。|纳税评估|纳税服务|税款追征|税款征收||1||||||
大企业的纳税评估，一般采用（   ）等方式。|案头审计和实地审计|申报审核和案头审核|申报审核和实地审计|申报审核、案头审计和实地审计||1||||||
（   ）是法治的基本特征，是法治的理念基础。|法律至上|限权|人权|自由保障||1||||||
现代税收管理信息化的体系架构，推进六项建设不包括：（    ）|IT治理|IT服务|信息资源|信息安全||1|||||p223六项建设是：建设现代税收管理信息化体系，要推进基础设施、信息系统、信息资源、IT服务、信息安全、人才队伍六项建设。|p223六项建设是：建设现代税收管理信息化体系，要推进基础设施、信息系统、信息资源、IT服务、信息安全、人才队伍六项建设。
（   ）是税务机关依法对纳税人、扣缴义务人等管理相对人履行法定义务的情况进行监督、审查的执法活动。|税务检查|税务稽查|税务督查|税务管理||1||||||
（    ）是同级人民法院之间受理第一审行政案件的分工和权限|地域管辖|级别管辖|裁定管辖|指定管辖||1||||||
对税务机关的征税行为提起诉讼，必须先经过行政复议；对行政复议决定不服的，可以在接到复议决定书之日起（   ）日内向人民法院起诉。|15|7|20|60||1||||||
根据法律规定，人民法院接到税务行政诉讼诉状，经过审查，应当在（    ）日内立案或者作出不予立案的裁定。|5|7|10|15||2||||||
以下关于信息化概念说法错误的是（    ）|信息化的动力——信息技术的需求增长|信息化的核心——信息资源的充分利用|信息化的过程——伴随着社会生活的巨大变迁|信息化的结果——最终将形成一种新社会文明状态||1||||||
（    ）是信息化的发展目标。|智能化|网络化|数字化|泛在化||1||||||
纳税评估是指税务机关运用数据信息对比分析的方法，对纳税人和扣缴义务人纳税申报情况的真实性和准确性作出定性和定量的判断，并采取进一步征管措施的（     ）。|管理行为|检查行为|服务行为|执法行为||1||||||
税务审计是纳税评估中的特殊方式。税务审计一般是针对（    ）开展纳税评估的方法。|大企业|一般纳税人|小规模纳税人|小企业||1||||||
下列不属于税收风险应对策略的是（    ）|实地核查|纳税评估|税务稽查|税务审计||1||||||
纳税评估的意义不包括（    ）|纳税评估是对自主申报合理性、准确性的确认|纳税评估是税收执法的主要方式|纳税评估有利于提高纳税人税法遵从度|纳税评估体现税务机关税收综合管理能力||1|||||p224纳税评估的意义（一）纳税评估是对自主申报真实性、准确性的确认（二）纳税评估是税收执法的主要方式（三）纳税评估有利于提高纳税人税法遵从度（四）纳税评估体现税务机关税收综合管理能力（五）纳税评估有利于提高社会税收法律意识|p224纳税评估的意义（一）纳税评估是对自主申报真实性、准确性的确认（二）纳税评估是税收执法的主要方式（三）纳税评估有利于提高纳税人税法遵从度（四）纳税评估体现税务机关税收综合管理能力（五）纳税评估有利于提高社会税收法律意识
以下属于征管信息系统现有数据的是（    ）。|历史评估稽查信息|主要生产设备及设计生产能力|银行流水信息|生产经营房屋的使用情况||1||||||
第三方资料不包括（    ）|工商登记信息|互联网公开资料|微信朋友圈个人信息|行业协会公告||3||||||
税务机关使用相关数据时，应当向纳税人进行核实，对（    ）数据，评估中可以直接使用。|互联网发布的新闻|行业协会公开的资料|国家机关提供的数据|企业网站发布的信息||3||||||
以下属于身份及生产经营特征分析的内容是（    ）|就纳税人存在的跨国跨区、进出口、电子商务等交易行为，参照同类型交易行为存在的风险特征进行分析，找出表现异常的涉税疑点|通过对纳税人纳税申报、发票使用、纳税评估记录、税务稽查记录等方面开展分析，了解纳税人当前和历史的税法遵从情况，找出表现异常的涉税疑点。|对税务登记、涉及税收政策等方面开展分析，了解纳税人的基本现状，找出需要重点关注的事项和表现异常的涉税疑点，同时提出身份及生产经营特征分析方向。|通过纳税人风险情况综合分析，应当对纳税人遵守财务制度和税收管理要求情况作出初步判断。||1||||||
预案评审需要对评估预案及单户综合分析报告等资料进行评审。审议内容不包括（    ）|处理处罚是否合理|预案内容是否齐全|评估事项是否明确|时间安排是否合理||1|||||p232审议内容主要包括：1．深度分析是否完整2．预案内容是否齐全3．评估事项是否明确4．检查方式是否恰当5．时间安排是否合理|p232审议内容主要包括：1．深度分析是否完整2．预案内容是否齐全3．评估事项是否明确4．检查方式是否恰当5．时间安排是否合理
评估分析人员通过对纳税人基本情况分析，找出其中需要重点关注的事项，识别可能存在的涉税疑点，提出评估建议，形成纳税人基本情况分析报告，该报告不包括以下内容：（    ）|行业特征分析|基础信息分析|税收表现分析|对数据准备阶段采集的生产经营数据和纳税人的非常规情报信息，进行补充分析||1||||||
深度分析的内容不包括（    ）|综合分析|风险识别结果指向分析|身份及生产经营特征分析|证据固定分析||4||||||
征管信息系统现有数据不包括:（    ）|税务登记信息|资格认定信息|纳税申报信息|生产计划信息||4||||||
下列不属于案头审核的方式有（     ）|电话|信函|约谈|实地调查||4||||||
在案头审核阶段,需要纳税人在约定的时间到税务机关办公场所就涉税疑点进行说明解释并提供举证时可以采取的措施是（   ）。|电话|信函|约谈|资料审查||3||||||
约谈人员不得少于（   ）名，约谈过程中应制作询问笔录。|1|2|3|任意||2||||||
对需要查询纳税人或扣缴义务人在银行或者其他金融机构存款账户的，经（   ）税务局（分局）局长批准后，出具《检查存款账户许可证明》，到对应银行实施检查。|县以上|设区的市以上|地市以上|省市级以上||1||||||
下列选项中不属于电话询问形成的录音资料须注明的内容是（   ）。|制作方法|制作时间|证明对象|制作介质||4||||||
采取直接收款方式销售货物，增值税纳税义务发生时间为（    ），先开具发票的，为开具发票的当天。|发出货物的当天|不论货物是否发出，均为收到销售款或者取得索取销售款凭据的当天；|书面合同约定的收款日期的当天|会计确认收入的当天||2||||||
采取托收承付和委托银行收款方式销售货物，增值税纳税义务发生时间为（    ），先开具发票的，为开具发票的当天。|发出货物并办妥托收手续的当天|不论货物是否发出，均为收到销售款或者取得索取销售款凭据的当天；|书面合同约定的收款日期的当天|会计确认收入的当天||1||||||
采取赊销和分期收款方式销售货物，增值税纳税义务发生时间为（    ），先开具发票的，为开具发票的当天。|发出货物并办妥托收手续的当天|不论货物是否发出，均为收到销售款或者取得索取销售款凭据的当天；|书面合同约定的收款日期的当天，无书面合同的或者书面合同没有约定收款日期的，为货物发出的当天|会计确认收入的当天||3||||||
委托其他纳税人代销货物，增值税纳税义务发生时间为（    ），未收到代销清单及货款的，为发出代销货物满180天的当天；|为收到代销单位的代销清单或者收到全部或者部分货款的当天|不论货物是否发出，均为收到销售款或者取得索取销售款凭据的当天；|书面合同约定的收款日期的当天，无书面合同的或者书面合同没有约定收款日期的，为货物发出的当天|会计确认收入的当天||1||||||
销售应税劳务，增值税纳税义务发生时间为（    ）|为提供劳务同时收讫销售款或者取得索取销售款的凭据的当天|应税劳务完成的当天；|书面合同约定的收款日期的当天|会计确认收入的当天||1||||||
企业采取缩短折旧年限方法的，对其购置的新固定资产，最低折旧年限不得低于《企业所得税法实施条例》第六十条规定的折旧年限的（    ）|60％|40％|30％|70％||1||||||
根据税法规定，下列固定资产可以计算折旧扣除的是（    ）：|房屋、建筑物以外未投入使用的固定资产|以经营租赁方式租出的固定资产|以融资租赁方式租出的固定资产|已足额提取折旧仍继续使用的固定资产||2|||||征管评估P250 下列固定资产不得计算折旧扣除：房屋、建筑物以外未投入使用的固定资产；以经营租赁方式租入的固定资产；以融资租赁方式租出的固定资产；已足额提取折旧仍继续使用的固定资产；与经营活动无关的固定资产；单独估价作为固定资产入账的土地；其他不得计算折旧扣除的固定资产。 |征管评估P250 下列固定资产不得计算折旧扣除：房屋、建筑物以外未投入使用的固定资产；以经营租赁方式租入的固定资产；以融资租赁方式租出的固定资产；已足额提取折旧仍继续使用的固定资产；与经营活动无关的固定资产；单独估价作为固定资产入账的土地；其他不得计算折旧扣除的固定资产。 
